{
  "schemaVersion":"1.0.0-draft","topologyModule":{"id":"repeating-parallel-profile-wall-2d","version":"1.0.0-draft"},"periodicity":{"value":0.6,"authority":{"state":"user-confirmed","sourceRefs":["review:c-spacing"]}},"projectedArea":{"value":0.6,"authority":{"state":"validated-default","sourceRefs":["contract:unit-out-of-plane-length"]}},"layers":[{"id":"insulation-zone","thickness":{"value":0.15,"authority":{"state":"ifc-derived","sourceRefs":["IfcMaterialLayer[0].LayerThickness"]}},"material":{"value":"mineral-wool","authority":{"state":"ifc-derived","sourceRefs":["IfcMaterialLayer[0].Material.Name"]}}}],"rows":[{"id":"c-row","offsetX":{"value":0,"authority":{"state":"user-confirmed","sourceRefs":["review:c-offset"]}},"originY":{"value":0,"authority":{"state":"user-confirmed","sourceRefs":["review:c-depth"]}},"member":{"primitive":{"kind":"standard.c","version":"1.0.0","parameters":{"depth":0.15,"flangeWidth":0.05,"gauge":0.0015,"lipWidth":0.012}},"material":{"value":"galvanized-steel","authority":{"state":"user-confirmed","sourceRefs":["review:c-material"]}}}}],"cavities":[],"thermalBreaks":[],"boundaries":{"exterior":{"value":"external-wall","authority":{"state":"validated-default","sourceRefs":["surface-profile:external-wall"]}},"interior":{"value":"internal","authority":{"state":"validated-default","sourceRefs":["surface-profile:external-wall"]}},"left":"periodic","right":"periodic"}
}
