{
  "schemaVersion":"1.0.0-draft","topologyModule":{"id":"repeating-parallel-profile-wall-2d","version":"1.0.0-draft"},"periodicity":{"value":1.5,"authority":{"state":"user-confirmed","sourceRefs":["review:z-spacing"]}},"projectedArea":{"value":1.5,"authority":{"state":"validated-default","sourceRefs":["contract:unit-out-of-plane-length"]}},"layers":[{"id":"insulation-zone","thickness":{"value":0.2,"authority":{"state":"ifc-derived","sourceRefs":["IfcMaterialLayer[0].LayerThickness"]}},"material":{"value":"mineral-wool","authority":{"state":"ifc-derived","sourceRefs":["IfcMaterialLayer[0].Material.Name"]}}}],"rows":[{"id":"z-girt","offsetX":{"value":0,"authority":{"state":"user-confirmed","sourceRefs":["review:z-offset"]}},"originY":{"value":0.02,"authority":{"state":"user-confirmed","sourceRefs":["review:z-depth"]}},"member":{"primitive":{"kind":"standard.z","version":"1.0.0","parameters":{"depth":0.16,"flangeWidth":0.06,"gauge":0.0015,"lipWidth":0.015}},"material":{"value":"galvanized-steel","authority":{"state":"user-confirmed","sourceRefs":["review:z-material"]}}}}],"cavities":[],"thermalBreaks":[],"boundaries":{"exterior":{"value":"external-wall","authority":{"state":"validated-default","sourceRefs":["surface-profile:external-wall"]}},"interior":{"value":"internal","authority":{"state":"validated-default","sourceRefs":["surface-profile:external-wall"]}},"left":"periodic","right":"periodic"}
}
