{
  "schemaVersion":"1.0.0-draft","topologyModule":{"id":"repeating-parallel-profile-wall-2d","version":"1.0.0-draft"},"periodicity":{"value":0.6,"authority":{"state":"user-confirmed","sourceRefs":["review:double-c-spacing"]}},"projectedArea":{"value":0.6,"authority":{"state":"validated-default","sourceRefs":["contract:unit-out-of-plane-length"]}},"layers":[{"id":"service-zone","thickness":{"value":0.2,"authority":{"state":"user-confirmed","sourceRefs":["review:wall-depth"]}},"material":{"value":"mineral-wool","authority":{"state":"ifc-derived","sourceRefs":["IfcMaterialLayer[0].Material.Name"]}}}],"rows":[{"id":"outer-c","offsetX":{"value":0,"authority":{"state":"user-confirmed","sourceRefs":["review:alignment"]}},"originY":{"value":0,"authority":{"state":"user-confirmed","sourceRefs":["review:outer-depth"]}},"member":{"primitive":{"kind":"standard.c","version":"1.0.0","parameters":{"depth":0.09,"flangeWidth":0.04,"gauge":0.0015,"lipWidth":0.01}},"material":{"value":"galvanized-steel","authority":{"state":"user-confirmed","sourceRefs":["review:steel"]}}}},{"id":"inner-c","offsetX":{"value":0,"authority":{"state":"user-confirmed","sourceRefs":["review:alignment"]}},"originY":{"value":0.11,"authority":{"state":"user-confirmed","sourceRefs":["review:inner-depth"]}},"member":{"primitive":{"kind":"standard.c","version":"1.0.0","parameters":{"depth":0.09,"flangeWidth":0.04,"gauge":0.0015,"lipWidth":0.01}},"material":{"value":"galvanized-steel","authority":{"state":"user-confirmed","sourceRefs":["review:steel"]}}}}],"cavities":[],"thermalBreaks":[],"boundaries":{"exterior":{"value":"external-wall","authority":{"state":"validated-default","sourceRefs":["surface-profile:external-wall"]}},"interior":{"value":"internal","authority":{"state":"validated-default","sourceRefs":["surface-profile:external-wall"]}},"left":"periodic","right":"periodic"}
}
