{
  "boundaries": {
    "exterior": {
      "authority": {
        "sourceRefs": [
          "surface-profile:external-wall"
        ],
        "state": "validated-default"
      },
      "value": "external-wall"
    },
    "interior": {
      "authority": {
        "sourceRefs": [
          "surface-profile:external-wall"
        ],
        "state": "validated-default"
      },
      "value": "internal"
    },
    "left": "periodic",
    "right": "periodic"
  },
  "cavities": [],
  "layers": [
    {
      "id": "outer-board",
      "material": {
        "authority": {
          "sourceRefs": [
            "IfcMaterialLayer[0].Material.Name"
          ],
          "state": "ifc-derived"
        },
        "value": "gypsum"
      },
      "thickness": {
        "authority": {
          "sourceRefs": [
            "IfcMaterialLayer[0].LayerThickness"
          ],
          "state": "ifc-derived"
        },
        "value": 0.0125
      }
    },
    {
      "id": "stud-zone",
      "material": {
        "authority": {
          "sourceRefs": [
            "IfcMaterialLayer[1].Material.Name"
          ],
          "state": "ifc-derived"
        },
        "value": "mineral-wool"
      },
      "thickness": {
        "authority": {
          "sourceRefs": [
            "review:stud-depth"
          ],
          "state": "user-confirmed"
        },
        "value": 0.14
      }
    }
  ],
  "periodicity": {
    "authority": {
      "sourceRefs": [
        "review:timber-spacing"
      ],
      "state": "user-confirmed"
    },
    "value": 0.6
  },
  "projectedArea": {
    "authority": {
      "sourceRefs": [
        "contract:unit-out-of-plane-length"
      ],
      "state": "validated-default"
    },
    "value": 0.6
  },
  "rows": [
    {
      "id": "timber-row",
      "member": {
        "material": {
          "authority": {
            "sourceRefs": [
              "review:timber-material"
            ],
            "state": "user-confirmed"
          },
          "value": "softwood"
        },
        "primitive": {
          "kind": "standard.rectangle",
          "parameters": {
            "depth": 0.14,
            "width": 0.045
          },
          "version": "1.0.0"
        }
      },
      "offsetX": {
        "authority": {
          "sourceRefs": [
            "pack:timber-600"
          ],
          "state": "validated-default"
        },
        "value": 0
      },
      "originY": {
        "authority": {
          "sourceRefs": [
            "pack:timber-600"
          ],
          "state": "validated-default"
        },
        "value": 0.0125
      }
    }
  ],
  "schemaVersion": "1.0.0-draft",
  "thermalBreaks": [],
  "topologyModule": {
    "id": "repeating-parallel-profile-wall-2d",
    "version": "1.0.0-draft"
  }
}
